{
  "$schema": "http://json-schema.org/draft-07/schema#",
  "title": "Pitch Arcade microgame v1",
  "type": "object",
  "additionalProperties": false,
  "properties": {
    "v": {
      "const": 1
    },
    "title": {
      "type": "string",
      "minLength": 3,
      "maxLength": 24,
      "pattern": "^[A-Za-z0-9 !?'&]+$"
    },
    "verb": {
      "type": "string",
      "enum": [
        "DODGE",
        "AVOID",
        "SURVIVE",
        "EVADE",
        "DUCK",
        "DEFEND",
        "CATCH",
        "COLLECT",
        "GRAB",
        "FEED",
        "GATHER",
        "FETCH",
        "SCOOP",
        "HARVEST",
        "REACH",
        "ESCAPE",
        "FIND",
        "DELIVER",
        "RACE",
        "GUIDE",
        "POP",
        "CLICK",
        "SHOOT",
        "TAP",
        "BURST",
        "SMASH",
        "MASH",
        "PUMP",
        "CHARGE",
        "BOOST"
      ]
    },
    "seconds": {
      "type": "number",
      "minimum": 4,
      "maximum": 8,
      "default": 5
    },
    "palette": {
      "type": "string",
      "enum": [
        "sunset",
        "ocean",
        "candy",
        "forest",
        "midnight",
        "citrus",
        "ice",
        "mono"
      ]
    },
    "pattern": {
      "type": "string",
      "enum": [
        "none",
        "dots",
        "stripes",
        "grid",
        "stars"
      ]
    },
    "player": {
      "type": "object",
      "additionalProperties": false,
      "properties": {
        "emoji": {
          "type": "string",
          "enum": [
            "😀",
            "😃",
            "😄",
            "😁",
            "😆",
            "😅",
            "😂",
            "🙂",
            "🙃",
            "😉",
            "😊",
            "😇",
            "🥰",
            "😍",
            "🤩",
            "😋",
            "😛",
            "😜",
            "🤪",
            "😝",
            "🤗",
            "🤭",
            "🤫",
            "🤔",
            "🤐",
            "🤨",
            "😐",
            "😑",
            "😶",
            "😏",
            "😌",
            "😴",
            "🤤",
            "😪",
            "😮",
            "😯",
            "😲",
            "🥳",
            "😎",
            "🤓",
            "🧐",
            "🤠",
            "🥸",
            "🤖",
            "👽",
            "👾",
            "👻",
            "🎃",
            "😺",
            "😸",
            "😹",
            "😻",
            "😼",
            "😽",
            "🙀",
            "😿",
            "😾",
            "🙈",
            "🙉",
            "🙊",
            "🧑",
            "👨",
            "👩",
            "👶",
            "🧒",
            "👦",
            "👧",
            "🧓",
            "👴",
            "👵",
            "🧑‍🍳",
            "🧑‍🚀",
            "🧑‍🎨",
            "🧑‍🌾",
            "🧑‍🔬",
            "🧑‍🚒",
            "🧙",
            "🧚",
            "🧜",
            "🧝",
            "🧞",
            "🧑‍🏫",
            "🧑‍💻",
            "🕺",
            "💃",
            "🐵",
            "🐒",
            "🦍",
            "🦧",
            "🐶",
            "🐕",
            "🦮",
            "🐩",
            "🐺",
            "🦊",
            "🦝",
            "🐱",
            "🐈",
            "🦁",
            "🐯",
            "🐅",
            "🐆",
            "🐴",
            "🐎",
            "🦄",
            "🦓",
            "🦌",
            "🦬",
            "🐮",
            "🐂",
            "🐃",
            "🐄",
            "🐷",
            "🐖",
            "🐗",
            "🐽",
            "🐏",
            "🐑",
            "🐐",
            "🐪",
            "🐫",
            "🦙",
            "🦒",
            "🐘",
            "🦣",
            "🦏",
            "🦛",
            "🐭",
            "🐁",
            "🐀",
            "🐹",
            "🐰",
            "🐇",
            "🐿️",
            "🦫",
            "🦔",
            "🦇",
            "🐻",
            "🐨",
            "🐼",
            "🦥",
            "🦦",
            "🦨",
            "🦘",
            "🦡",
            "🐾",
            "🦃",
            "🐔",
            "🐓",
            "🐣",
            "🐤",
            "🐥",
            "🐦",
            "🐧",
            "🕊️",
            "🦅",
            "🦆",
            "🦢",
            "🦉",
            "🦤",
            "🦩",
            "🦚",
            "🦜",
            "🐸",
            "🐊",
            "🐢",
            "🦎",
            "🐍",
            "🐲",
            "🐉",
            "🦕",
            "🦖",
            "🐳",
            "🐋",
            "🐬",
            "🦭",
            "🐟",
            "🐠",
            "🐡",
            "🦈",
            "🐙",
            "🐚",
            "🐌",
            "🦋",
            "🐛",
            "🐜",
            "🐝",
            "🪲",
            "🐞",
            "🦗",
            "🕷️",
            "🕸️",
            "🦂",
            "🦟",
            "🪰",
            "🪱",
            "🦠",
            "💐",
            "🌸",
            "💮",
            "🪷",
            "🌹",
            "🥀",
            "🌺",
            "🌻",
            "🌼",
            "🌷",
            "🌱",
            "🪴",
            "🌲",
            "🌳",
            "🌴",
            "🌵",
            "🌾",
            "🌿",
            "☘️",
            "🍀",
            "🍁",
            "🍂",
            "🍃",
            "🪹",
            "🪺",
            "🍄",
            "🪨",
            "🪵",
            "🌰",
            "🌍",
            "🌎",
            "🌏",
            "🌐",
            "🗺️",
            "🗾",
            "🧭",
            "🏔️",
            "⛰️",
            "🌋",
            "🗻",
            "🏕️",
            "🏖️",
            "🏜️",
            "🏝️",
            "🏞️",
            "🌅",
            "🌄",
            "🌠",
            "🎇",
            "🎆",
            "🌈",
            "🌉",
            "🌌",
            "⭐",
            "🌟",
            "✨",
            "☀️",
            "🌤️",
            "⛅",
            "🌥️",
            "☁️",
            "🌦️",
            "🌧️",
            "🌮",
            "🚀",
            "🎈",
            "🎯",
            "🎮",
            "🎲",
            "🧩",
            "🏆",
            "💎",
            "🔑",
            "💡",
            "⏰",
            "⌛",
            "⏳",
            "☔",
            "☂️",
            "🌊",
            "🍇",
            "🍈",
            "🍉",
            "🍊",
            "🍋",
            "🍌",
            "🍍",
            "🥭",
            "🍎",
            "🍏",
            "🍐",
            "🍑",
            "🍒",
            "🍓",
            "🫐",
            "🥝",
            "🍅",
            "🫒",
            "🥥",
            "🥑",
            "🍆",
            "🥔",
            "🥕",
            "🌽",
            "🌶️",
            "🫑",
            "🥒",
            "🥬",
            "🥦",
            "🧄",
            "🧅",
            "🥜",
            "🫘",
            "🍞",
            "🥐",
            "🥖",
            "🫓",
            "🥨",
            "🥯",
            "🥞",
            "🧇",
            "🧀",
            "🍖"
          ]
        },
        "control": {
          "type": "string",
          "enum": [
            "move_lr",
            "move_4",
            "click",
            "mash"
          ]
        },
        "speed": {
          "type": "number",
          "minimum": 1,
          "maximum": 10
        },
        "size": {
          "type": "string",
          "enum": [
            "s",
            "m",
            "l"
          ]
        }
      },
      "required": [
        "emoji",
        "control",
        "speed",
        "size"
      ]
    },
    "spawners": {
      "type": "array",
      "minItems": 0,
      "maxItems": 4,
      "items": {
        "type": "object",
        "additionalProperties": false,
        "properties": {
          "emoji": {
            "type": "string",
            "enum": [
              "😀",
              "😃",
              "😄",
              "😁",
              "😆",
              "😅",
              "😂",
              "🙂",
              "🙃",
              "😉",
              "😊",
              "😇",
              "🥰",
              "😍",
              "🤩",
              "😋",
              "😛",
              "😜",
              "🤪",
              "😝",
              "🤗",
              "🤭",
              "🤫",
              "🤔",
              "🤐",
              "🤨",
              "😐",
              "😑",
              "😶",
              "😏",
              "😌",
              "😴",
              "🤤",
              "😪",
              "😮",
              "😯",
              "😲",
              "🥳",
              "😎",
              "🤓",
              "🧐",
              "🤠",
              "🥸",
              "🤖",
              "👽",
              "👾",
              "👻",
              "🎃",
              "😺",
              "😸",
              "😹",
              "😻",
              "😼",
              "😽",
              "🙀",
              "😿",
              "😾",
              "🙈",
              "🙉",
              "🙊",
              "🧑",
              "👨",
              "👩",
              "👶",
              "🧒",
              "👦",
              "👧",
              "🧓",
              "👴",
              "👵",
              "🧑‍🍳",
              "🧑‍🚀",
              "🧑‍🎨",
              "🧑‍🌾",
              "🧑‍🔬",
              "🧑‍🚒",
              "🧙",
              "🧚",
              "🧜",
              "🧝",
              "🧞",
              "🧑‍🏫",
              "🧑‍💻",
              "🕺",
              "💃",
              "🐵",
              "🐒",
              "🦍",
              "🦧",
              "🐶",
              "🐕",
              "🦮",
              "🐩",
              "🐺",
              "🦊",
              "🦝",
              "🐱",
              "🐈",
              "🦁",
              "🐯",
              "🐅",
              "🐆",
              "🐴",
              "🐎",
              "🦄",
              "🦓",
              "🦌",
              "🦬",
              "🐮",
              "🐂",
              "🐃",
              "🐄",
              "🐷",
              "🐖",
              "🐗",
              "🐽",
              "🐏",
              "🐑",
              "🐐",
              "🐪",
              "🐫",
              "🦙",
              "🦒",
              "🐘",
              "🦣",
              "🦏",
              "🦛",
              "🐭",
              "🐁",
              "🐀",
              "🐹",
              "🐰",
              "🐇",
              "🐿️",
              "🦫",
              "🦔",
              "🦇",
              "🐻",
              "🐨",
              "🐼",
              "🦥",
              "🦦",
              "🦨",
              "🦘",
              "🦡",
              "🐾",
              "🦃",
              "🐔",
              "🐓",
              "🐣",
              "🐤",
              "🐥",
              "🐦",
              "🐧",
              "🕊️",
              "🦅",
              "🦆",
              "🦢",
              "🦉",
              "🦤",
              "🦩",
              "🦚",
              "🦜",
              "🐸",
              "🐊",
              "🐢",
              "🦎",
              "🐍",
              "🐲",
              "🐉",
              "🦕",
              "🦖",
              "🐳",
              "🐋",
              "🐬",
              "🦭",
              "🐟",
              "🐠",
              "🐡",
              "🦈",
              "🐙",
              "🐚",
              "🐌",
              "🦋",
              "🐛",
              "🐜",
              "🐝",
              "🪲",
              "🐞",
              "🦗",
              "🕷️",
              "🕸️",
              "🦂",
              "🦟",
              "🪰",
              "🪱",
              "🦠",
              "💐",
              "🌸",
              "💮",
              "🪷",
              "🌹",
              "🥀",
              "🌺",
              "🌻",
              "🌼",
              "🌷",
              "🌱",
              "🪴",
              "🌲",
              "🌳",
              "🌴",
              "🌵",
              "🌾",
              "🌿",
              "☘️",
              "🍀",
              "🍁",
              "🍂",
              "🍃",
              "🪹",
              "🪺",
              "🍄",
              "🪨",
              "🪵",
              "🌰",
              "🌍",
              "🌎",
              "🌏",
              "🌐",
              "🗺️",
              "🗾",
              "🧭",
              "🏔️",
              "⛰️",
              "🌋",
              "🗻",
              "🏕️",
              "🏖️",
              "🏜️",
              "🏝️",
              "🏞️",
              "🌅",
              "🌄",
              "🌠",
              "🎇",
              "🎆",
              "🌈",
              "🌉",
              "🌌",
              "⭐",
              "🌟",
              "✨",
              "☀️",
              "🌤️",
              "⛅",
              "🌥️",
              "☁️",
              "🌦️",
              "🌧️",
              "🌮",
              "🚀",
              "🎈",
              "🎯",
              "🎮",
              "🎲",
              "🧩",
              "🏆",
              "💎",
              "🔑",
              "💡",
              "⏰",
              "⌛",
              "⏳",
              "☔",
              "☂️",
              "🌊",
              "🍇",
              "🍈",
              "🍉",
              "🍊",
              "🍋",
              "🍌",
              "🍍",
              "🥭",
              "🍎",
              "🍏",
              "🍐",
              "🍑",
              "🍒",
              "🍓",
              "🫐",
              "🥝",
              "🍅",
              "🫒",
              "🥥",
              "🥑",
              "🍆",
              "🥔",
              "🥕",
              "🌽",
              "🌶️",
              "🫑",
              "🥒",
              "🥬",
              "🥦",
              "🧄",
              "🧅",
              "🥜",
              "🫘",
              "🍞",
              "🥐",
              "🥖",
              "🫓",
              "🥨",
              "🥯",
              "🥞",
              "🧇",
              "🧀",
              "🍖"
            ]
          },
          "role": {
            "type": "string",
            "enum": [
              "hazard",
              "goal",
              "target",
              "decor"
            ]
          },
          "from": {
            "type": "string",
            "enum": [
              "top",
              "bottom",
              "left",
              "right",
              "edges",
              "random",
              "center"
            ]
          },
          "every": {
            "anyOf": [
              {
                "type": "number",
                "minimum": 0.15,
                "maximum": 3
              },
              {
                "const": "once"
              }
            ]
          },
          "max": {
            "type": "integer",
            "minimum": 1,
            "maximum": 40
          },
          "motion": {
            "type": "string",
            "enum": [
              "fall",
              "rise",
              "sweep",
              "bounce",
              "chase",
              "flee",
              "still",
              "popup"
            ]
          },
          "speed": {
            "type": "number",
            "minimum": 1,
            "maximum": 10
          },
          "size": {
            "type": "string",
            "enum": [
              "s",
              "m",
              "l"
            ]
          }
        },
        "required": [
          "emoji",
          "role",
          "from",
          "every",
          "max",
          "motion",
          "speed",
          "size"
        ]
      }
    },
    "win": {
      "oneOf": [
        {
          "type": "object",
          "additionalProperties": false,
          "properties": {
            "type": {
              "const": "survive"
            }
          },
          "required": [
            "type"
          ]
        },
        {
          "type": "object",
          "additionalProperties": false,
          "properties": {
            "type": {
              "const": "collect"
            },
            "n": {
              "type": "integer",
              "minimum": 1,
              "maximum": 100
            },
            "role": {
              "type": "string",
              "enum": [
                "goal"
              ]
            }
          },
          "required": [
            "type",
            "n"
          ]
        },
        {
          "type": "object",
          "additionalProperties": false,
          "properties": {
            "type": {
              "const": "reach"
            },
            "role": {
              "type": "string",
              "enum": [
                "goal"
              ]
            }
          },
          "required": [
            "type"
          ]
        },
        {
          "type": "object",
          "additionalProperties": false,
          "properties": {
            "type": {
              "const": "hit"
            },
            "n": {
              "type": "integer",
              "minimum": 1,
              "maximum": 100
            },
            "role": {
              "type": "string",
              "enum": [
                "target"
              ]
            }
          },
          "required": [
            "type",
            "n"
          ]
        },
        {
          "type": "object",
          "additionalProperties": false,
          "properties": {
            "type": {
              "const": "mash"
            },
            "n": {
              "type": "integer",
              "minimum": 1,
              "maximum": 100
            }
          },
          "required": [
            "type",
            "n"
          ]
        }
      ]
    },
    "lose": {
      "oneOf": [
        {
          "type": "object",
          "additionalProperties": false,
          "properties": {
            "type": {
              "const": "timeout"
            }
          },
          "required": [
            "type"
          ]
        },
        {
          "type": "object",
          "additionalProperties": false,
          "properties": {
            "type": {
              "const": "touch"
            },
            "role": {
              "type": "string",
              "enum": [
                "hazard",
                "goal",
                "target",
                "decor"
              ]
            }
          },
          "required": [
            "type",
            "role"
          ]
        }
      ]
    },
    "mods": {
      "type": "array",
      "maxItems": 2,
      "uniqueItems": true,
      "items": {
        "type": "string",
        "enum": [
          "wind_left",
          "wind_right",
          "mirror",
          "spotlight",
          "floor_lava",
          "speedup"
        ]
      }
    },
    "sfx": {
      "type": "string",
      "enum": [
        "pop",
        "boom",
        "ding",
        "none"
      ]
    }
  },
  "required": [
    "v",
    "title",
    "verb",
    "palette",
    "pattern",
    "player",
    "spawners",
    "win",
    "lose",
    "mods",
    "sfx"
  ]
}
