{
  "v": 1,
  "title": "Moon Escape",
  "verb": "ESCAPE",
  "seconds": 5,
  "palette": "forest",
  "pattern": "grid",
  "player": {
    "emoji": "🧑‍🍳",
    "control": "move_4",
    "speed": 6,
    "size": "m"
  },
  "spawners": [
    {
      "emoji": "🌮",
      "role": "goal",
      "from": "random",
      "every": 0.35,
      "max": 12,
      "motion": "still",
      "speed": 5,
      "size": "m"
    }
  ],
  "win": {
    "type": "reach"
  },
  "lose": {
    "type": "timeout"
  },
  "mods": [
    "mirror"
  ],
  "sfx": "pop"
}
