{
  "v": 1,
  "title": "Taco Rain",
  "verb": "DODGE",
  "seconds": 5,
  "palette": "sunset",
  "pattern": "none",
  "player": {
    "emoji": "🧑‍🍳",
    "control": "move_4",
    "speed": 6,
    "size": "m"
  },
  "spawners": [
    {
      "emoji": "🌮",
      "role": "hazard",
      "from": "center",
      "every": 0.35,
      "max": 12,
      "motion": "still",
      "speed": 5,
      "size": "m"
    }
  ],
  "win": {
    "type": "survive"
  },
  "lose": {
    "type": "touch",
    "role": "hazard"
  },
  "mods": [
    "floor_lava"
  ],
  "sfx": "pop"
}
