{
  "v": 1,
  "title": "Star Chase",
  "verb": "COLLECT",
  "seconds": 5,
  "palette": "citrus",
  "pattern": "none",
  "player": {
    "emoji": "🧑‍🍳",
    "control": "move_4",
    "speed": 6,
    "size": "m"
  },
  "spawners": [
    {
      "emoji": "🌮",
      "role": "goal",
      "from": "random",
      "every": 0.35,
      "max": 12,
      "motion": "flee",
      "speed": 5,
      "size": "m"
    }
  ],
  "win": {
    "type": "collect",
    "n": 3
  },
  "lose": {
    "type": "timeout"
  },
  "mods": [
    "wind_right"
  ],
  "sfx": "pop"
}
